[
  {
    "name": "ABREU, Casimiro de",
    "alias": null,
    "birth_year": 1839,
    "death_year": 1860,
    "country": "BR",
    "url_wikipedia": null,
    "url_photo": null
  },
  {
    "name": "AFANASIEV, Alexandr Nikoláievich",
    "alias": null,
    "birth_year": 1826,
    "death_year": 1871,
    "country": "RU",
    "url_wikipedia": null,
    "url_photo": null
  },
  {
    "name": "AGUSTÍ, Ignacio",
    "alias": null,
    "birth_year": 1913,
    "death_year": 1974,
    "country": "ES",
    "url_wikipedia": null,
    "url_photo": null
  },
  {
    "name": "AGUSTÍN DE HIPONA",
    "alias": null,
    "birth_year": 354,
    "death_year": 430,
    "country": "DZ",
    "url_wikipedia": null,
    "url_photo": null
  },
  {
    "name": "AJMATOVA, Anna",
    "alias": null,
    "birth_year": 1889,
    "death_year": 1966,
    "country": "UA",
    "url_wikipedia": null,
    "url_photo": null
  },
  {
    "name": "ALAIN-FOURNIER",
    "alias": "de FOURNIER, Henri-Alban",
    "birth_year": 1886,
    "death_year": 1914,
    "country": "FR",
    "url_wikipedia": "https://en.wikipedia.org/wiki/Alain-Fournier",
    "url_photo": "https://commons.wikimedia.org/wiki/Special:FilePath/Alain-Fournier%20in%201905.jpg"
  },
  {
    "name": "ALARCÓN, Pedro Antonio de",
    "alias": "Pedro A. de Alarcón",
    "birth_year": 1833,
    "death_year": 1891,
    "country": "ES",
    "url_wikipedia": "https://en.wikipedia.org/wiki/Pedro_Antonio_de_Alarc%C3%B3n",
    "url_photo": "https://commons.wikimedia.org/wiki/Special:FilePath/Pedro%20Antonio%20de%20Alarc%C3%B3n.jpg"
  },
  {
    "name": "ALAS, Leopoldo",
    "alias": "CLARÍN",
    "birth_year": 1852,
    "death_year": 1901,
    "country": "ES",
    "url_wikipedia": "https://en.wikipedia.org/wiki/Leopoldo_Alas",
    "url_photo": "https://commons.wikimedia.org/wiki/Special:FilePath/LeopoldoAlasClarin.jpg"
  },
  {
    "name": "ALBERTI, Rafael",
    "alias": null,
    "birth_year": 1902,
    "death_year": 1999,
    "country": "ES",
    "url_wikipedia": null,
    "url_photo": null
  },
  {
    "name": "ALCOTT, Louise May",
    "alias": "A. M. Barnard",
    "birth_year": 1832,
    "death_year": 1888,
    "country": "US",
    "url_wikipedia": "https://en.wikipedia.org/wiki/Louisa_May_Alcott",
    "url_photo": "https://commons.wikimedia.org/wiki/Special:FilePath/Louisa%20May%20Alcott%2C%20c.%201870%20-%20Warren%27s%20Portraits%2C%20Boston.jpg"
  },
  {
    "name": "ALDANA, Francisco de",
    "alias": null,
    "birth_year": 1537,
    "death_year": 1578,
    "country": "ES",
    "url_wikipedia": "https://en.wikipedia.org/wiki/Francisco_de_Aldana",
    "url_photo": "https://commons.wikimedia.org/wiki/Special:FilePath/Francisco%20de%20aldana%20800px.jpg"
  },
  {
    "name": "ALDECOA, Ignacio",
    "alias": "Igna",
    "birth_year": 1925,
    "death_year": 1969,
    "country": "ES",
    "url_wikipedia": "https://en.wikipedia.org/wiki/Ignacio_Aldecoa",
    "url_photo": "https://commons.wikimedia.org/wiki/Special:FilePath/Vitoria%20-%20La%20Florida%2001.JPG"
  },
  {
    "name": "ALEGRÍA, Ciro",
    "alias": null,
    "birth_year": 1909,
    "death_year": 1967,
    "country": "PE",
    "url_wikipedia": "https://en.wikipedia.org/wiki/Ciro_Alegr%C3%ADa",
    "url_photo": "https://commons.wikimedia.org/wiki/Special:FilePath/Ciro%20Alegr%C3%ADa.JPG"
  },
  {
    "name": "ALEIXANDRE, Vicente",
    "alias": null,
    "birth_year": 1898,
    "death_year": 1984,
    "country": "ES",
    "url_wikipedia": "https://en.wikipedia.org/wiki/Vicente_Aleixandre",
    "url_photo": "https://commons.wikimedia.org/wiki/Special:FilePath/Spaanse%20dichter%20en%20nobelprijswinnaar%20Vicente%20Alexandre%2C%20Bestanddeelnr%20929-3851.jpg"
  },
  {
    "name": "ALEMÁN, Mateo",
    "alias": null,
    "birth_year": 1547,
    "death_year": 1614,
    "country": "ES",
    "url_wikipedia": "https://en.wikipedia.org/wiki/Mateo_Alem%C3%A1n",
    "url_photo": "https://commons.wikimedia.org/wiki/Special:FilePath/Retrato%20de%20Mateo%20Alem%C3%A1n.jpg"
  },
  {
    "name": "ALENCAR, José Martiniano de",
    "alias": "Erasmo",
    "birth_year": 1829,
    "death_year": 1877,
    "country": "BR",
    "url_wikipedia": "https://en.wikipedia.org/wiki/Jos%C3%A9_de_Alencar",
    "url_photo": "https://commons.wikimedia.org/wiki/Special:FilePath/Jos%C3%A9%20de%20Alencar.jpg"
  },
  {
    "name": "ALFONSO X EL SABIO",
    "alias": null,
    "birth_year": 1221,
    "death_year": 1284,
    "country": "ES",
    "url_wikipedia": null,
    "url_photo": null
  },
  {
    "name": "ALLER, César",
    "alias": null,
    "birth_year": 1927,
    "death_year": null,
    "country": "ES",
    "url_wikipedia": null,
    "url_photo": null
  },
  {
    "name": "ALMEIDA GARRET, João Baptista da Silva Leitão de",
    "alias": null,
    "birth_year": 1799,
    "death_year": 1854,
    "country": "PT",
    "url_wikipedia": "https://en.wikipedia.org/wiki/Almeida_Garrett",
    "url_photo": "https://commons.wikimedia.org/wiki/Special:FilePath/Almeida%20Garrett%20por%20Guglielmi.jpg"
  },
  {
    "name": "ALONSO, Dámaso",
    "alias": null,
    "birth_year": 1899,
    "death_year": 1990,
    "country": "ES",
    "url_wikipedia": null,
    "url_photo": null
  },
  {
    "name": "ANDERSEN, Hans Christian",
    "alias": null,
    "birth_year": 1805,
    "death_year": 1875,
    "country": "DK",
    "url_wikipedia": "https://en.wikipedia.org/wiki/Hans_Christian_Andersen",
    "url_photo": "https://commons.wikimedia.org/wiki/Special:FilePath/HCA%20by%20Thora%20Hallager%201869.jpg"
  },
  {
    "name": "ANDRES, Stefan",
    "alias": "Octavio Kant",
    "birth_year": 1906,
    "death_year": 1970,
    "country": "DE",
    "url_wikipedia": "https://en.wikipedia.org/wiki/Stefan_Andres",
    "url_photo": "https://commons.wikimedia.org/wiki/Special:FilePath/Niederpruemer-hof-stefan-andres-gedenktafel.jpg"
  },
  {
    "name": "ANDRIC, Ivo",
    "alias": null,
    "birth_year": 1892,
    "death_year": 1975,
    "country": "BA",
    "url_wikipedia": "https://en.wikipedia.org/wiki/Ivo_Andri%C4%87",
    "url_photo": "https://commons.wikimedia.org/wiki/Special:FilePath/S.%20Kragujevic%2C%20Ivo%20Andric%2C%201961.jpg"
  },
  {
    "name": "ANONYME",
    "alias": null,
    "birth_year": null,
    "death_year": null,
    "country": null,
    "url_wikipedia": null,
    "url_photo": null
  },
  {
    "name": "ANOUILH, Jean",
    "alias": null,
    "birth_year": 1910,
    "death_year": 1987,
    "country": "FR",
    "url_wikipedia": "https://en.wikipedia.org/wiki/Jean_Anouilh",
    "url_photo": "https://commons.wikimedia.org/wiki/Special:FilePath/Anouilh%201940%202b.jpg"
  },
  {
    "name": "ANÓNIMO",
    "alias": null,
    "birth_year": 1320,
    "death_year": 1360,
    "country": null,
    "url_wikipedia": null,
    "url_photo": null
  },
  {
    "name": "APOLONIO DE RODAS",
    "alias": null,
    "birth_year": -294,
    "death_year": -214,
    "country": "EG",
    "url_wikipedia": null,
    "url_photo": null
  },
  {
    "name": "ARCINIEGAS, Germán",
    "alias": null,
    "birth_year": 1900,
    "death_year": 1999,
    "country": "CO",
    "url_wikipedia": null,
    "url_photo": null
  },
  {
    "name": "ARGUEDAS, Alcides",
    "alias": null,
    "birth_year": 1879,
    "death_year": 1946,
    "country": "BO",
    "url_wikipedia": null,
    "url_photo": null
  },
  {
    "name": "ARIOSTO, Ludovico",
    "alias": null,
    "birth_year": 1474,
    "death_year": 1533,
    "country": "IT",
    "url_wikipedia": null,
    "url_photo": null
  },
  {
    "name": "ARKELL, Réginald",
    "alias": null,
    "birth_year": 1882,
    "death_year": 1959,
    "country": "GB",
    "url_wikipedia": "https://en.wikipedia.org/wiki/Reginald_Arkell",
    "url_photo": null
  },
  {
    "name": "ARNIM, Achim von",
    "alias": null,
    "birth_year": 1781,
    "death_year": 1831,
    "country": "DE",
    "url_wikipedia": null,
    "url_photo": null
  },
  {
    "name": "ARNIM, Elizabeth von",
    "alias": "Alice Cholmondeley",
    "birth_year": 1866,
    "death_year": 1941,
    "country": "GB",
    "url_wikipedia": "https://en.wikipedia.org/wiki/Elizabeth_von_Arnim",
    "url_photo": "https://commons.wikimedia.org/wiki/Special:FilePath/Elizabeth%20von%20arnim%20pencil%20sketch.jpg"
  },
  {
    "name": "ARÉVALO MARTÍNEZ, Rafael",
    "alias": null,
    "birth_year": 1884,
    "death_year": 1975,
    "country": "GT",
    "url_wikipedia": "https://en.wikipedia.org/wiki/Rafael_Ar%C3%A9valo_Mart%C3%ADnez",
    "url_photo": "https://commons.wikimedia.org/wiki/Special:FilePath/Rafaelarevalomartinez30.jpg"
  },
  {
    "name": "ASCASUBI, Hilario",
    "alias": null,
    "birth_year": 1807,
    "death_year": 1875,
    "country": "AR",
    "url_wikipedia": "https://en.wikipedia.org/wiki/Hilario_Ascasubi",
    "url_photo": "https://commons.wikimedia.org/wiki/Special:FilePath/HilarioAscasubi.JPG"
  },
  {
    "name": "ASTURIAS, Miguel Ángel",
    "alias": null,
    "birth_year": 1899,
    "death_year": 1974,
    "country": "GT",
    "url_wikipedia": "https://en.wikipedia.org/wiki/Miguel_%C3%81ngel_Asturias",
    "url_photo": "https://commons.wikimedia.org/wiki/Special:FilePath/Miguel%20Angel%20Asturias.jpg"
  },
  {
    "name": "AUCLAIR, Marcelle",
    "alias": null,
    "birth_year": 1899,
    "death_year": 1983,
    "country": "FR",
    "url_wikipedia": "https://en.wikipedia.org/wiki/Marcelle_Auclair",
    "url_photo": "https://commons.wikimedia.org/wiki/Special:FilePath/Marcelle%20Auclair.png"
  },
  {
    "name": "AUSTEN, Jane",
    "alias": null,
    "birth_year": 1775,
    "death_year": 1817,
    "country": "GB",
    "url_wikipedia": "https://en.wikipedia.org/wiki/Jane_Austen",
    "url_photo": "https://commons.wikimedia.org/wiki/Special:FilePath/CassandraAusten-JaneAusten%28c.1810%29%20hires.jpg"
  },
  {
    "name": "AYALA, Francisco",
    "alias": null,
    "birth_year": 1906,
    "death_year": 2009,
    "country": "ES",
    "url_wikipedia": null,
    "url_photo": null
  },
  {
    "name": "AZORÍN",